[
  {
    "subquestion_id": "sq-sjukvard-huvudman",
    "party": "s",
    "current": {
      "position": "inget_tydligt_besked",
      "statement_id": null
    },
    "statements": [],
    "changes": [],
    "last_searched": "2026-09-23"
  },
  {
    "subquestion_id": "sq-sjukvard-huvudman",
    "party": "m",
    "current": {
      "position": "inget_tydligt_besked",
      "statement_id": null
    },
    "statements": [],
    "changes": [],
    "last_searched": "2026-09-23"
  },
  {
    "subquestion_id": "sq-sjukvard-huvudman",
    "party": "sd",
    "current": {
      "position": "inget_tydligt_besked",
      "statement_id": null
    },
    "statements": [],
    "changes": [],
    "last_searched": "2026-09-23"
  },
  {
    "subquestion_id": "sq-sjukvard-huvudman",
    "party": "c",
    "current": {
      "position": "inget_tydligt_besked",
      "statement_id": null
    },
    "statements": [],
    "changes": [],
    "last_searched": "2026-09-23"
  },
  {
    "subquestion_id": "sq-sjukvard-huvudman",
    "party": "v",
    "current": {
      "position": "nej",
      "statement_id": "st-2026-0042"
    },
    "statements": [
      {
        "id": "st-2026-0042",
        "position": "nej",
        "condition_note": null,
        "quote": "Vänsterpartiet vill inte förstatliga vården.",
        "person": null,
        "date_stated": "2026-07-15",
        "source": {
          "url": "https://www.vansterpartiet.se/var-politik/politik-a-o/halso-och-sjukvardens-huvudmannaskap/",
          "domain": "vansterpartiet.se",
          "archive_url": "https://web.archive.org/web/20260501100155/https://www.vansterpartiet.se/var-politik/politik-a-o/halso-och-sjukvardens-huvudmannaskap/",
          "fetched_at": "2026-07-15T21:53:57.192Z"
        },
        "source_status": "ok",
        "source_checked_at": "2026-08-24",
        "related_promise_ids": [],
        "extraction": {
          "model": "manuell (skarpare källa)",
          "verified_by": "mänsklig granskning",
          "run_id": "manual-stances-2026-07-15"
        }
      }
    ],
    "changes": [],
    "last_searched": "2026-09-23"
  },
  {
    "subquestion_id": "sq-sjukvard-huvudman",
    "party": "kd",
    "current": {
      "position": "ja",
      "statement_id": "st-2026-0063"
    },
    "statements": [
      {
        "id": "st-2026-0035",
        "position": "ja",
        "condition_note": null,
        "quote": "Kristdemokraterna driver sedan lång tid tillbaka frågan om ett statligt huvudmannaansvar för sjukvården, för att skapa en mer jämlik och tillgänglig vård.",
        "person": null,
        "date_stated": "2026-07-15",
        "source": {
          "url": "https://kristdemokraterna.se/var-politik/politik-a-till-o/sjukvard",
          "domain": "kristdemokraterna.se",
          "archive_url": "https://web.archive.org/web/20260312132909/https://kristdemokraterna.se/var-politik/politik-a-till-o/sjukvard",
          "fetched_at": "2026-07-15T21:31:23.793Z"
        },
        "source_status": "ok",
        "source_checked_at": "2026-10-12",
        "related_promise_ids": [],
        "extraction": {
          "model": "manuell (skarpare källa)",
          "verified_by": "mänsklig granskning",
          "run_id": "manual-stances-2026-07-15"
        }
      },
      {
        "id": "st-2026-0063",
        "position": "ja",
        "condition_note": null,
        "quote": "Vi vill avskaffa regionerna och låta staten ta över ansvaret och styrningen över sjukvården.",
        "person": null,
        "date_stated": "2026-08-13",
        "source": {
          "url": "https://kristdemokraterna.se/var-politik/politik-a-till-o/regionerna",
          "domain": "kristdemokraterna.se",
          "archive_url": "https://web.archive.org/web/20260824052337/https://kristdemokraterna.se/var-politik/politik-a-till-o/regionerna",
          "fetched_at": "2026-08-16T06:41:40.052Z"
        },
        "source_status": "ok",
        "source_checked_at": "2026-10-12",
        "related_promise_ids": [],
        "extraction": {
          "model": "deepseek-v4-pro",
          "verified_by": "kimi-k2.7-code",
          "run_id": "run-2026-08-13-10-18"
        }
      }
    ],
    "changes": [],
    "last_searched": "2026-09-23"
  },
  {
    "subquestion_id": "sq-sjukvard-huvudman",
    "party": "l",
    "current": {
      "position": "inget_tydligt_besked",
      "statement_id": null
    },
    "statements": [],
    "changes": [],
    "last_searched": "2026-09-23"
  },
  {
    "subquestion_id": "sq-sjukvard-huvudman",
    "party": "mp",
    "current": {
      "position": "inget_tydligt_besked",
      "statement_id": null
    },
    "statements": [],
    "changes": [],
    "last_searched": "2026-09-23"
  },
  {
    "subquestion_id": "sq-sjukvard-vinst",
    "party": "s",
    "current": {
      "position": "inget_tydligt_besked",
      "statement_id": null
    },
    "statements": [],
    "changes": [],
    "last_searched": "2026-09-23"
  },
  {
    "subquestion_id": "sq-sjukvard-vinst",
    "party": "m",
    "current": {
      "position": "inget_tydligt_besked",
      "statement_id": null
    },
    "statements": [],
    "changes": [],
    "last_searched": "2026-09-23"
  },
  {
    "subquestion_id": "sq-sjukvard-vinst",
    "party": "sd",
    "current": {
      "position": "inget_tydligt_besked",
      "statement_id": null
    },
    "statements": [],
    "changes": [],
    "last_searched": "2026-09-23"
  },
  {
    "subquestion_id": "sq-sjukvard-vinst",
    "party": "c",
    "current": {
      "position": "villkorat",
      "statement_id": "st-2026-0003"
    },
    "statements": [
      {
        "id": "st-2026-0003",
        "position": "villkorat",
        "condition_note": "Det ska inte gå en krona till vinst om välfärdsföretag inte håller kvaliteten och uppfyller de krav som ställs.",
        "quote": "Det ska inte gå en krona till vinst om välfärdsföretag inte håller kvaliteten och uppfyller de krav som ställs.",
        "person": null,
        "date_stated": "2026-06-04",
        "source": {
          "url": "https://val2026.centerpartiet.se/wp-content/uploads/2026/06/Valmanifest-2026.pdf#page=45",
          "domain": "val2026.centerpartiet.se",
          "archive_url": "https://web.archive.org/web/20260703171331/https://val2026.centerpartiet.se/wp-content/uploads/2026/06/Valmanifest-2026.pdf#page=45",
          "fetched_at": "2026-07-13T18:20:47.385Z"
        },
        "source_status": "ok",
        "source_checked_at": "2026-10-12",
        "related_promise_ids": [],
        "extraction": {
          "model": "deepseek/deepseek-v4-pro",
          "verified_by": "moonshotai/kimi-k2.7-code",
          "run_id": "stances-backfill-2026-07-12"
        }
      }
    ],
    "changes": [],
    "last_searched": "2026-09-23"
  },
  {
    "subquestion_id": "sq-sjukvard-vinst",
    "party": "v",
    "current": {
      "position": "ja",
      "statement_id": "st-2026-0020"
    },
    "statements": [
      {
        "id": "st-2026-0020",
        "position": "ja",
        "condition_note": null,
        "quote": "Vänsterpartiet vill stoppa vinsterna i välfärden och sätta patienterna först.",
        "person": null,
        "date_stated": "2026-07-12",
        "source": {
          "url": "https://www.vansterpartiet.se/val2026/",
          "domain": "vansterpartiet.se",
          "archive_url": "https://web.archive.org/web/20260712173102/https://www.vansterpartiet.se/val2026/",
          "fetched_at": "2026-07-13T18:30:53.476Z"
        },
        "source_status": "ok",
        "source_checked_at": "2026-08-24",
        "related_promise_ids": [],
        "extraction": {
          "model": "deepseek/deepseek-v4-pro",
          "verified_by": "moonshotai/kimi-k2.7-code",
          "run_id": "stances-backfill-2026-07-12"
        }
      }
    ],
    "changes": [],
    "last_searched": "2026-09-23"
  },
  {
    "subquestion_id": "sq-sjukvard-vinst",
    "party": "kd",
    "current": {
      "position": "inget_tydligt_besked",
      "statement_id": null
    },
    "statements": [],
    "changes": [],
    "last_searched": "2026-09-23"
  },
  {
    "subquestion_id": "sq-sjukvard-vinst",
    "party": "l",
    "current": {
      "position": "inget_tydligt_besked",
      "statement_id": null
    },
    "statements": [],
    "changes": [],
    "last_searched": "2026-09-23"
  },
  {
    "subquestion_id": "sq-sjukvard-vinst",
    "party": "mp",
    "current": {
      "position": "ja",
      "statement_id": "st-2026-0015"
    },
    "statements": [
      {
        "id": "st-2026-0015",
        "position": "ja",
        "condition_note": null,
        "quote": "Skattepengar avsedda för vård och omsorg ska gå till verksamheten, inte tas ut som vinst till aktieägare.",
        "person": null,
        "date_stated": "2026-07-12",
        "source": {
          "url": "https://www.mp.se/wp-content/uploads/2026/04/politiskt-handlingsprogram-2026-2030.pdf#page=73",
          "domain": "mp.se",
          "archive_url": "https://web.archive.org/web/20260709052238/https://www.mp.se/wp-content/uploads/2026/04/politiskt-handlingsprogram-2026-2030.pdf#page=73",
          "fetched_at": "2026-07-13T18:25:47.949Z"
        },
        "source_status": "ok",
        "source_checked_at": "2026-10-12",
        "related_promise_ids": [],
        "extraction": {
          "model": "deepseek/deepseek-v4-pro",
          "verified_by": "moonshotai/kimi-k2.7-code",
          "run_id": "stances-backfill-2026-07-12"
        }
      }
    ],
    "changes": [],
    "last_searched": "2026-09-23"
  },
  {
    "subquestion_id": "sq-skola-vinst",
    "party": "s",
    "current": {
      "position": "ja",
      "statement_id": "st-2026-0053"
    },
    "statements": [
      {
        "id": "st-2026-0018",
        "position": "ja",
        "condition_note": null,
        "quote": "Vinstförbud i skola och förskola.",
        "person": null,
        "date_stated": "2026-02-04",
        "source": {